{
  "$schema": "http://json-schema.org/draft-07/schema#",
  "title": "Per-card certification record v1",
  "type": "object",
  "additionalProperties": false,
  "required": ["schema_version", "card_identity_id", "definition_sha256", "engine_sha256", "rules_version", "format_version", "status", "recorded_at", "source_references", "ability_branches", "cases", "reviewers", "limitations"],
  "properties": {
    "schema_version": {"const": 1},
    "card_identity_id": {"type": "string", "minLength": 1, "maxLength": 160},
    "definition_sha256": {"anyOf": [{"type": "string", "pattern": "^[a-f0-9]{64}$"}, {"type": "null"}]},
    "engine_sha256": {"anyOf": [{"type": "string", "pattern": "^[a-f0-9]{64}$"}, {"type": "null"}]},
    "rules_version": {"enum": [null, "2.2.0", "2.3.0"]},
    "format_version": {"type": ["string", "null"], "minLength": 1, "maxLength": 128},
    "status": {"enum": ["template_not_executed", "draft", "tested", "interaction_certified"]},
    "recorded_at": {"type": ["string", "null"], "pattern": "^\\d{4}-\\d{2}-\\d{2}T\\d{2}:\\d{2}:\\d{2}(?:\\.\\d{3})?Z$"},
    "source_references": {
      "type": "array", "maxItems": 128,
      "items": {"type": "object", "additionalProperties": false, "required": ["source_id", "sha256", "rule_reference"], "properties": {
        "source_id": {"type": "string", "minLength": 1, "maxLength": 128},
        "sha256": {"type": "string", "pattern": "^[a-f0-9]{64}$"},
        "rule_reference": {"type": "string", "pattern": "^\\d+(?:\\.\\d+){2,}$"}
      }}
    },
    "ability_branches": {"type": "array", "uniqueItems": true, "maxItems": 128, "items": {"type": "string", "minLength": 1, "maxLength": 128}},
    "cases": {
      "type": "array", "maxItems": 512,
      "items": {"type": "object", "additionalProperties": false, "required": ["case_id", "scenario_id", "branch", "dimensions", "intent", "expected_public_events", "expected_private_state", "negative_case", "evidence_run"], "properties": {
        "case_id": {"type": "string", "minLength": 1, "maxLength": 128},
        "scenario_id": {"type": "string", "pattern": "^SCN-[0-9]{3}$"},
        "branch": {"type": "string", "minLength": 1, "maxLength": 128},
        "dimensions": {"type": "array", "minItems": 1, "uniqueItems": true, "items": {"enum": ["cost", "target", "timing", "positive", "negative", "interaction"]}},
        "intent": {"type": "string", "minLength": 1, "maxLength": 4096},
        "expected_public_events": {"type": "array", "items": {"type": "string", "maxLength": 4096}, "maxItems": 128},
        "expected_private_state": {"type": "array", "items": {"type": "string", "maxLength": 4096}, "maxItems": 128},
        "negative_case": {"type": "boolean"},
        "evidence_run": {"type": ["string", "null"], "pattern": "^RUN-[0-9]{8}-[0-9]{3}$"}
      }}
    },
    "reviewers": {"type": "array", "uniqueItems": true, "maxItems": 16, "items": {"type": "string", "minLength": 1, "maxLength": 128}},
    "limitations": {"type": "array", "uniqueItems": true, "maxItems": 128, "items": {"type": "string", "minLength": 1, "maxLength": 4096}}
  }
}
