{
  "schema_version": 1,
  "card_identity_id": "REPLACE_WITH_CANONICAL_IDENTITY",
  "definition_sha256": null,
  "engine_sha256": null,
  "rules_version": null,
  "format_version": null,
  "status": "template_not_executed",
  "recorded_at": null,
  "source_references": [],
  "ability_branches": [],
  "cases": [],
  "reviewers": [],
  "limitations": ["Copy and complete the record for one exact identity/definition/rules/format/engine revision. This template has no execution, certification or admission."]
}
